{
  "$schema": "./schema.gen.json",
  "organizations": [
    {
      "name": "Acme Corp"
    },
    {
      "name": "TechStart Labs"
    }
  ],
  "people": [
    {
      "name": "John Doe",
      "email": "john@acme.com",
      "job_title": "Software Engineer",
      "linkedin_username": "johndoe",
      "organization": "Acme Corp"
    },
    {
      "name": "Sarah Chen",
      "email": "sarah@acme.com",
      "job_title": "Product Manager",
      "linkedin_username": "sarahchen",
      "organization": "Acme Corp"
    },
    {
      "name": "Michael Rodriguez",
      "email": "michael@acme.com",
      "job_title": "Engineering Lead",
      "linkedin_username": "mrodriguez",
      "organization": "Acme Corp"
    },
    {
      "name": "Emma Watson",
      "email": "emma@techstart.com",
      "job_title": "CEO",
      "linkedin_username": "emmawatson",
      "organization": "TechStart Labs"
    },
    {
      "name": "David Kim",
      "email": "david@techstart.com",
      "job_title": "VP Engineering",
      "linkedin_username": "davidkim",
      "organization": "TechStart Labs"
    }
  ],
  "calendars": [
    {
      "name": "Work Calendar"
    },
    {
      "name": "Team Meetings"
    }
  ],
  "folders": [
    {
      "name": "Projects",
      "parent": null
    },
    {
      "name": "Q4 Planning",
      "parent": "Projects"
    }
  ],
  "tags": [
    {
      "name": "Important"
    },
    {
      "name": "Action Items"
    },
    {
      "name": "Strategic"
    }
  ],
  "templates": [
    {
      "title": "Meeting Notes",
      "description": "Template for meeting notes",
      "sections": [
        {
          "title": "Attendees",
          "description": "Who was present"
        },
        {
          "title": "Agenda",
          "description": "Topics to discuss"
        },
        {
          "title": "Discussion",
          "description": "What was discussed"
        },
        {
          "title": "Action Items",
          "description": "Next steps and owners"
        }
      ]
    }
  ],
  "events": [
    {
      "name": "Q4 Product Strategy Planning",
      "calendar": "Team Meetings",
      "started_at": "2025-10-28T10:00:00Z",
      "ended_at": "2025-10-28T11:30:00Z",
      "location": "Conference Room A",
      "meeting_link": "https://meet.example.com/q4-planning",
      "description": "Strategic planning session for Q4 product roadmap",
      "note": "Discuss feature priorities and timeline"
    }
  ],
  "sessions": [
    {
      "title": "Q4 Strategy Meeting",
      "raw_md": "## Q4 Product Strategy\n\nAttendees: John Doe, Sarah Chen, Michael Rodriguez\n\nDiscussed Q4 roadmap, feature priorities, resource allocation, and timeline for product releases...",
      "folder": "Q4 Planning",
      "event": "Q4 Product Strategy Planning",
      "participants": ["John Doe", "Sarah Chen", "Michael Rodriguez"],
      "tags": ["Important", "Strategic"],
      "transcript": {
        "segments": [
          {
            "channel": 0,
            "start_ms": 0,
            "end_ms": 20000,
            "text": " Good morning everyone, thanks for joining the Q4 product strategy meeting. Let's dive right in.",
            "words": [
              {
                "text": " Good",
                "start_ms": 0,
                "end_ms": 2000
              },
              {
                "text": " morning",
                "start_ms": 2000,
                "end_ms": 4000
              },
              {
                "text": " everyone",
                "start_ms": 4000,
                "end_ms": 6000
              },
              {
                "text": " thanks",
                "start_ms": 6000,
                "end_ms": 8000
              },
              {
                "text": " for",
                "start_ms": 8000,
                "end_ms": 9200
              },
              {
                "text": " joining",
                "start_ms": 9200,
                "end_ms": 11200
              },
              {
                "text": " the",
                "start_ms": 11200,
                "end_ms": 12000
              },
              {
                "text": " Q4",
                "start_ms": 12000,
                "end_ms": 13200
              },
              {
                "text": " product",
                "start_ms": 13200,
                "end_ms": 15200
              },
              {
                "text": " strategy",
                "start_ms": 15200,
                "end_ms": 17200
              },
              {
                "text": " meeting",
                "start_ms": 17200,
                "end_ms": 18800
              },
              {
                "text": " dive",
                "start_ms": 18800,
                "end_ms": 20000
              }
            ]
          },
          {
            "channel": 0,
            "start_ms": 20000,
            "end_ms": 60000,
            "text": " Sarah, we'd love to hear about the market research you've been leading. Can you walk us through the findings from the customer survey? I think that's critical context for our discussion today.",
            "words": [
              {
                "text": " Sarah",
                "start_ms": 20000,
                "end_ms": 21600
              },
              {
                "text": " we'd",
                "start_ms": 21600,
                "end_ms": 22800
              },
              {
                "text": " love",
                "start_ms": 22800,
                "end_ms": 24000
              },
              {
                "text": " to",
                "start_ms": 24000,
                "end_ms": 24800
              },
              {
                "text": " hear",
                "start_ms": 24800,
                "end_ms": 26000
              },
              {
                "text": " about",
                "start_ms": 26000,
                "end_ms": 27600
              },
              {
                "text": " the",
                "start_ms": 27600,
                "end_ms": 28400
              },
              {
                "text": " market",
                "start_ms": 28400,
                "end_ms": 30000
              },
              {
                "text": " research",
                "start_ms": 30000,
                "end_ms": 32000
              },
              {
                "text": " survey",
                "start_ms": 32000,
                "end_ms": 34000
              },
              {
                "text": " critical",
                "start_ms": 34000,
                "end_ms": 36000
              },
              {
                "text": " context",
                "start_ms": 36000,
                "end_ms": 38000
              },
              {
                "text": " discussion",
                "start_ms": 38000,
                "end_ms": 40000
              },
              {
                "text": " today",
                "start_ms": 40000,
                "end_ms": 42000
              }
            ]
          },
          {
            "channel": 1,
            "start_ms": 60000,
            "end_ms": 180000,
            "text": " Absolutely John. So we conducted surveys across 2000 customers in our target market segments. The findings are really compelling and actionable. First, integration capabilities emerged as the top priority. 78% of survey respondents explicitly said they want better integration with existing tools like Salesforce, Slack, and other enterprise platforms. Second, performance has become critical. 65% mentioned they would seriously consider switching to a competitor if we could improve our performance. That's a significant number. Third, we discovered a pricing model issue. We're currently losing deals at the enterprise level because our tier structure doesn't align well with their requirements. They want more flexibility. We need to address these three areas to stay competitive.",
            "words": [
              {
                "text": " Absolutely",
                "start_ms": 60000,
                "end_ms": 62000
              },
              {
                "text": " John",
                "start_ms": 62000,
                "end_ms": 63200
              },
              {
                "text": " conducted",
                "start_ms": 63200,
                "end_ms": 65200
              },
              {
                "text": " surveys",
                "start_ms": 65200,
                "end_ms": 67200
              },
              {
                "text": " 2000",
                "start_ms": 67200,
                "end_ms": 68800
              },
              {
                "text": " customers",
                "start_ms": 68800,
                "end_ms": 71200
              },
              {
                "text": " target",
                "start_ms": 71200,
                "end_ms": 73200
              },
              {
                "text": " market",
                "start_ms": 73200,
                "end_ms": 75200
              },
              {
                "text": " segments",
                "start_ms": 75200,
                "end_ms": 77200
              },
              {
                "text": " findings",
                "start_ms": 77200,
                "end_ms": 79200
              },
              {
                "text": " compelling",
                "start_ms": 79200,
                "end_ms": 81600
              },
              {
                "text": " actionable",
                "start_ms": 81600,
                "end_ms": 84000
              },
              {
                "text": " integration",
                "start_ms": 84000,
                "end_ms": 86800
              },
              {
                "text": " capabilities",
                "start_ms": 86800,
                "end_ms": 89600
              },
              {
                "text": " priority",